Question,Answer
How do I get a share link to a folder,Folder share links are available in the same location as your file share links.  Simply click on the Share link to copy/paste your link.  This link remains static regardless if you move or rename the folder you are sharing.
How do I get a download link for a document,"There are several types of download links available in Doc Central for a document. All of these links are ""predictable"" and useful for placing in on a web site or Wiki/Jive page."
Getting a download to a PDF file,"If you want a download link to a PDF file and the file was not brought into Doc Central originally as a PDF file, you will need to generate the PDF version first.  A RED PDF icon means there is no PDF version yet generated and one needs to be. If there is a WHITE PDF icon then you can click on the icon and get your PDF version. Remember that unlike the above links the PDF links always link to a particular version of a document."
How do I create a PDF copy of a document,"In EDCS a PDF was created anytime you uploaded a Microsoft Office document into the system.  In Doc Central, to save space, we only create PDF copies of Microsoft Office documents when you request one.  To see if one needs to be created look at the PDF icon next to the version.  If it is RED then you need to request one,  if it is WHITE then it is created and can be downloaded.  To request a PDF just click on the RED icon.  You will receive an email once it is created.  See below screen shot:"
How do I mark a file or folder as a favorite,"Marking content as a ""favorite"" allows you to easily get back to the document at a later time.  You can mark a file or folder as a favorite either from the folder view or document view screens.
which when clicked turns it into a yellow star …"
How can I access my favorites,At the top of the any page in the black menu area you will see a My Favorites menu which can be clicked on to access your favorites.  To add a favorite see the above FAQ question on making a folder or file one of your favorites.
How can I delete a file,Currently the ability to delete a file is not present in Doc Central.  Since it is an ISO approved repository we need to put certain checks against users being able to perform this action.  Since Cisco Docs does allow this we are working on a solution.
How can I delete a folder,"Folders can be deleted by a Folder Admin as long as they are empty. If they are not empty, the contents must be moved to another location before you can delete it."
Microsoft Office cut and paste links do not redirect correctly into Doc Central,"If you are finding that a if you attempt to cut and paste a link into a Microsoft Office document (like Word) and the link does not redirect correctly into Doc Central, perform the steps below to fix the issue."
What are some common troubleshooting tips when I encounter an issue,"Doc Central, like any browser based solution, can have browser related issues that can sometimes be fixed by doing the following:
Clear your browser cache.
Try a different browser (Internet Explorer, Firefox or Chrome)
 "
Expanding the Document tree keeps jumping me to the top of the page,When traversing the Document tree if you click on the name of the folder it will expand and jump you back to the top of the Document tree (all browsers).  If you click on the folder icon next to the folder name it will expand and leave you where you are.  Use this tip to make moving through the Document tree faster.
Why is my document not previewing correctly in the browser window,There are several reasons why a document will not preview correctly in a browser window and they mostly have to do with how Doc Central generates PDF versions of the file (in the background) but cannot do so in certain cases.  We are working on surfacing up these reasons but for now use this list to help debug your issue.
What do you mean by a document life cycle,Doc Central refers to a document's life cycle when we are talking about version history as well as ISO workflow history.
Version History,Any time a new version of a document is uploaded into Doc Central the version is incremented. The increment can be managed by you and can be a minor version (i.e. 1.1 -> 1.2) or a major version (1.0 -> 2.0). At the time of upload you can give an explanation of your reason for the version change.
Workflow History,Documents that go through a workflow create a workflow history that can be accessed at any time. Currently the only workflow in Doc Central is an Approval Workflow. Details on how to run an approval workflow can be found in another FAQ post. To access a document's workflow history click on the link in the document preview page under Workflows. See screen shot.
How do I check out a document,"To checkout a document in Doc Central you need to have the Folder Admin, Owner or Editor permission role on the document. If you do navigate to the document's preview page and checkout the document from the Document Actions menu. When you checkout a document you lock it from others so they cannot checkout the document and edit it while you are doing so.  The checkout operation will open a download window so you can download a copy of the document to your system to work on."
How do I check in a document (also called Upload New Version),"Checking In a document is also called ""Upload New Version"". This action will upload the new version and remove the check out operation. You will notice that if you checked out a document you will also have the ability to cancel the checkout."
Why is it called Upload New Version,"It is called this because unlike EDCS where you had to Checkout a document in order to put in a new version, in Doc Central you can upload a new version without the need to check the old one out.  The only reason to checkout is to lock the file so others cannot work on it."
What's the difference between a Working Copy and an Original Document,"When a document is checked out a Working Copy of the file is created and downloaded out of Doc Central for you to work on. Along with the Working Copy their is also an Original Document which for all purposes is the same document. The reason for this is that the base Alfresco product allowed for online editing but the Cisco version, to date, does not."
How do I see the version history,The version history is displayed on the folder view as well as the page view page.  On the folder view we only display the latest three versions but in the page view we display them all.  The Version History is located on the right side of the document details page.
What are the different states for a document,"Doc Central has the following states for a document:
Approval N.A. (default state)
Draft
Approved
Obsolete
Grandfathered  (state assigned to some old documents migrated into Doc Central from outside systems)"
How can I change document state,"You must be an Owner, Editor or Folder Admin to change a document's state from Approval N.A. to Draft or into Obsolete. To make a document Approved it must go through an approval workflow which again can only be started by the same three roles. A document needs to be in the Draft state in order to start a workflow on it."
Where is Basic Search and what does it search on,"Basic Search is located in the upper right corner of your browser window when you log into Doc Central.  From this search window you can search for a document based on values found in their Title, Description, EDCS number or Tag value.  If you select drop down menu you be given an opportunity to proceed to the Advanced Search page."
Where is Advanced Search search and what does it search on,Advanced Search is found by selecting the drop down menu option found in the Basic Search Window.
What are the different roles and levels of permissions in Doc Central,"Each group will be assigned a folder structure for their documents. This folder structure will have one or more Folder Admins who will have the ability to create sub-folders and move documents into different sub-folders. To understand how you can use these different Doc Central roles let's review what they are (from least permissions to most).
A User is anyone at Cisco who has CEC credentials. They can log into Doc Central and view top level document information (title, author, etc ...). They cannot view or perform any actions on any documents.
A Reader can do anything a Viewer can do plus they have the ability to download a copy of the document.
A Viewer can preview a document online but cannot edit, download or perform any actions on it.
An Editor can perform everything a Reader can do plus editing actions such as checking a document in or out of the system and starting an approval or review workflow.  If someone has the Editor role on a folder they can bring documents into that folder which they will become an Owner of.
An Owner of a document is the user that first uploaded the document into Doc Central repository. They can perform all Editor role actions plus edit document properties and assign roles to other users for this document. Any new document uploaded into Doc Central automatically gives that user the Owner role but owners can also assign other users as an Owner/Editor/Reader/Viewer as well.  Finally Owners can use Grouper groups and assign role's on a group level.
A Folder Admin can do anything an Owner can do, but the purpose of the Folder Admin role is to manage an area's folders and not its documents. Folder Admins can create folders underneath the group's top level folder area, move documents between these folders as well as manage permissions for any user as it pertains to these folders and documents. They can also set up ""rules"" for a folder when certain things occur. A Folder Admin's ""job"" is to administer a group's document area, adding new users into it and managing the permissions on those users. The idea of the Folder Admin is to allow self administration of a group's area so as to reduce the need for IT support.
A Power Admin can do anything a Folder Admin can do plus they can add/remove any role to any folder or file at any time with no restrictions. This is a special role reserved for rare cases where this capability is required."
Who controls the roles and permissions in Doc Central,"The Folder Admin and document Owner control the roles and permissions assigned. Folder Admins control folders as well as files that reside in those folders (in most cases). An Owner controls the permissions on any file they own. In order to own a file, you need to be the user who initially brought the file into Doc Central or you need to be given the Owner role by the owner or a Folder Admin."
How do I know what role I have on a file or folder,When viewing a file either at the folder or file level view you will always see the highest level of permissions (i.e. role) for that object.
What is inheritance and what does it do,"Permission inheritance allows a document or folder to inherit the permissions from a folder higher up in the directory tree. Permissions can be inherited, set locally on the file or folder or both."
How do I provide access to my documents to everyone at Cisco,The answer is to use the default EVERYONE role that is in Doc Central. This group is everyone in Cisco who has access to Doc Central (i.e. anyone with CEC credentials). Give EVERYONE the Reader role for the documents/folders you wish to allow view rights for if you want them to Preview or Download a copy and Viewer role if you only want them to preview it online.
How do I share with customers and partners,Doc Central has an external sharing application integrated into it called Doc Exchange. Doc Exchange allows you to share content with customers and partners as long as they have CCO login credentials. You can share specific files or folders with specific customers. See Doc Exchange FAQS for more information.
How do I share Doc Central folders and files with my colleagues,"To share files in Doc Central all you need to do is include a Share Link in any email, post or correspondence and make sure that the people you are wanting to share it with have the correct access role assigned. The Share link can be found on the folder view or page preview view.
 
Roles to allows users to access content can be assigned using the Manage Permissions feature which is accessible to Owners and Folder Admins. Viewer role will allow users to preview the document in a browser, Reader will allow them to download a copy and Editor will allow them to edit and update the document."
How do I change the owner of a file,"To change or add an Owner to a file you need to be an Owner or Folder Admin on the file you wish to update. If you are do the following:
1. Select Manage Permissions button
2. Search for the user you wish to add in as an Owner
3. Add the user to the file and assign the Owner role"
How do I view the permissions on a file or folder,"On any file or folder in the system you can see your permissions on that object by looking for the Permission Role statement. This statement will be unique to you and your permissions for that object. On top of that, if you see a RED DOT next to the statement it denotes that permission inheritance is off."
Can I remove the EVERYONE group and what is it there for,The User role assigned to the EVERYONE group is a default user group placed on all content in Doc Central.  The purpose of this group is to allow everyone in the system to see all the content and to be able to perform searches to find this content. Note that the EVERYONE group provides very limited access to a document or folder.
Applying the User role EVERYONE can,"See that the item exists
See the title of the document, author and last modified date.
See the item as part of a search result"
Applying the User role EVERYONE cannot,"Preview, Edit, Download a Copy or perform any action other than seeing that the content exists.
 
Some users have requested that User role for EVERYONE be removed. IT can remove the User role for EVERYONE on your folder for special cases. If you have a valid use case to restrict or hide even the existence of your content from all but a select few users, please open a Remedy case and we will evaluate the request."
What types of workflows are supported in Doc Central,Doc Central currently supports an approval workflow.  The approval workflow is an ISO approved process that records all workflow history and will replace the approval workflow process in EDCS today.
How do I start a workflow,In order to start a workflow your document needs to be in Draft state. If is not in Draft state select Change Doc Status button and move the document from Approval N.A. to Draft. Once the document is in Draft you will see the Start Workflow button.
What is the difference between a parallel and serial workflow,A parallel workflow will send approval requests to all approvers at one time and there is no order to whom completes their tasks first. Once all approvers have accepted the document it will be marked as approved.  In a serial workflow the order of who you set up as approvers is followed and approver #2 will not get a request to approve the document until approver #1 has completed their task.
What happens when someone rejects a workflow,"When someone who has been asked to approve a document rejects it the rejected task goes back to the originator of the workflow for further action. The originator can then choose to cancel the workflow or resubmit the same document to the approver again with further clarification.
If the document needs to be updated, based on the comments provided by the user who rejected the document, the workflow needs to be cancelled. Once the updates have been made a new workflow can be started."
Who can cancel a workflow,The originator of the workflow plus any user who has Folder Admin rights on the document has the ability to cancel an active workflow.
How do I know if a document is currently in a workflow,"If a document is currently in an active workflow you will notice that the Document Action's menu has limited capabilities. This is because if there is an active workflow going on you do not want other users to be able to checkout, edit or upload a new version of the document."
How do I see the history of past workflows,To view the history of past workflows click on the title of the document to take you to the document details page.  On the right side scroll down to the Workflows menu and select the Workflow History link.
Can I update a document that is in an active workflow,You cannot update a document that is an active workflow. The workflow is for that particular version of the document. Any changes would increment the version and require a new workflow to be started.
How do I publish content from Doc Central to Doc Exchange,"If publishing is enabled from a folder, you can publish files by clicking on the Publish button under Document Actions and following the instructions on the screen. If publishing is disabled you will have to contact your folder admin to enable publishing.* Publishing may be disabled in some folders by design."
If a user uploads a file or a new version of a file in Doc Exchange will that be synced automatically to Doc Central,Currently there is no syncing from Doc Exchange to Doc Central. Users will have to manually upload content to Doc Central.
Why CiscoDocs is beeing migrated,"Cisco Docs uses EMC's Documentum as its back end and this is no longer being supported to the degree that is required by Cisco.  Doc Central, built on top of Alfresco, allows Cisco to meet required security features as well as provide an extendable infrastructure for future growth."
Cisco Docs to Doc Central Migration Overview,"During migration content will continue to be accessible through Cisco Docs.  Cisco Docs has approximately 70 TB of content and much of it is old so not all of it will be migrated.  Content that will be migrated will fall into one or more of these categories:
Content that is marked as a record (records retention schedule)
Content that was created or modified with the past 3 years
Content that was downloaded in the past year
Content that is on ""legal hold"""
What are the migration steps,"Migration will occur in the background during which time you will continue to work in Cisco Docs.  Based on the above freeze dates and cut over schedule, folders will be moved over and made active in Doc Central.
The Cisco Docs content will go to a temporary folder in Doc Central (Cisco Docs and EDCS Legacy -> Cisco Docs - Migration) with the current folder structure you had in Cisco Docs intact.  From this temporary location content owners should organize and move their content to its final ""home"" somewhere outside of this area.
Content will not be moved from the temporary area unless done so by the document owner or business group Folder Admins.  Content not migrated will remain in Cisco Docs for a year during which time you will be able to open a request to move it to Doc Central if needed."
What do I need to do to get ready for the migration,"To get ready for the migration it is best to do a few things ...
Identify where you content is in Cisco Docs.  By doing this you will be ready to organize and move it around once it gets migrated over.
Review the permission access you have set up.  Often groups are used to determine access to content so be sure to review these groups, who is present in them and what type of access they have.
Delete unwanted content.  Remove any empty folders or old documents you no longer require.
Decide who your Folder Admin's will be.  Folder Admin's help to administer the content in a folder area and can create new ones, move them around and rename them.  Decide who your folder admins should be to be in charge of this."
Is there a tool available that lets me migrate my content to Doc Central from Cisco Docs myself,"No. Currently there is no self-migration tool available. We are working on a tool so users can upload lots of documents at a single time, but if you have a significant amount of content in Cisco Docs today, you will need to wait until we are able to migrate over your content over. You could manually move over a small amount of content if you would prefer to do so, but it is not a automated process."
Will the Cisco Docs redirection links still work,Yes they will.  Cisco Doc redirection links till work and be redirected to their location in Doc Central.  We will support those redirects indefinitely but we do encourage you to update your links to use the new Doc Central syntax.
What Cisco Docs features are not yet in DocCentral,"Cisco Docs allows you to delete content.  Doc Central will add this feature, with restrictions, once we have developed and deployed the legal hold feature for Cisco's legal team.
Access reporting.  Cisco Docs provided a way to retrieve access reports on views and downloads.  We are working on adding that report feature."
Do I have an API for application Integration ,"Cisco Docs allows you to delete content.  Doc Central will add this feature, with restrictions, once we have developed and deployed the legal hold feature for Cisco's legal team.
Access reporting.  Cisco Docs provided a way to retrieve access reports on views and downloads.  We are working on adding that report feature."
Doc Central Live Support,"Click on <a href=""https://clicktochat.cloudapps.cisco.com/initiateChat.htm?appId=doc-central"" target=_blank>Doc Central Live Suppot</a>"
IT Support Management Platform Remedy,"Click on <a href=""https://itst-prd.cisco.com:5431/arsys/shared/login.jsp?/arsys/forms/itstapp/SRS:ServiceRequestConsole/?F303900000=3&F303906900=&F303906700=0&F303902000=0&F303902100=0&F303901700=doccentralsupport"" target=_blank>IT Support Management Platform Remedy_link</a>"
Doc Central application URL,"Click <a href=""https://docs-stg.cisco.com/share"" target=_blank>here</a>"
What are my post migration steps,"Migration will occur in the background during which time you will continue to work in Cisco Docs.  Based on the above freeze dates and cut over schedule, folders will be moved over and made active in Doc Central.
During the freeze period you will have read-only, download access to your Cisco Docs content.  If you have already checked out content in Cisco Docs and need to check it back in during the freeze period, wait till after the freeze period is over and perform an ""Upload New Version"" operation in Doc Central.
Content will not be moved from the temporary area unless done so by the document owner or business group Folder Admins.  This area will never be removed so technically you can keep your content here but we prefer you do not.  The idea is that you take this opportunity to organize your content and its folder structure, review the permissions for the content and then move it to the correct folder under the Documents folder tree.  If you think your content needs to be under the Documents -> Finance area ... use the Request New Folder button to get a folder where you have write access to move the folders/files into.
Your Cisco Docs content will go to a temporary folder in Doc Central (Cisco Docs and EDCS Legacy -> Cisco Docs - Migration) with the current folder structure you had in Cisco Docs intact.  From this temporary location content owners should organize and move their content to its final ""home"" somewhere outside of this area.
The only content not migrated is Cisco Docs archived content.  This content will remain in Cisco Docs for a year during which time you will be able to open a request to move it to Doc Central if needed."
Why can't I delete a document in Doc Central,"Presently the ability to delete a document has been disabled in Doc Central.  We are in the process of migrating terabytes of content from Cisco Docs, some of which are records.  Until these document migrate over and have record retention rules applied we cannot enable the delete feature.  Also there is a feature called ""legal hold"" that the Cisco legal teams need as they work on cases on behalf of Cisco.  That feature, along with records retention, needs to be in place before the delete feature can be enabled.
If you must have a document deleted here are the steps:
Mark the document as Obsolete (use Change Doc Status button).  If document is in Approval N.A. state you need to first make it Draft and then can make it Obsolete.  Making a document Obsolete will also remove it from a normal Doc Central search result (use can, in Advanced Search, search on Obsolete files).
Create a TRASH folder for your group and place your obsoleted documents you want to delete in there.
Periodically open a case to get these files removed.  We ask you not to ask every time you have a single file to delete as this process is a manual task.  The level 1 support team does not have the capability to delete files.  A Doc Central senior tech administrator needs to review the files to make sure they are OK to delete and perform the clean up.
 
In the vast majority of cases the files are ""goofs"" and easy to identify and delete.  This is a temporary process until the migration is done, records are converted and legal holds are put in place.  Estimated time of enabling the delete feature is January 2018."
"How long will the content say in this ""temporary area"" on Doc Central",Content will stay in the temporary location until it's moved or until it has reached its deletion date under the purge rule or record retention rule (depending on whether it has been designated a record or not).
